randid,Date_EventStart_Consistent,Date_EventEnd_Consistent,GeneralDesc,CompletionDesc,Asset,states,Commissioning_Date,DC_Size_kW,AC_Size_kW,PlantType,ArrayType,InverterType,InverterOEM
C3S220,2018-09-24 09:30:00:00,2018-09-24 14:45:00:00,south louisburg --- inv 1 --- forced outage Canceled OE deleted in batch process: OE-10823750. inv showing 0 production verified thru meter. 0000 - Unknown,I've added coolant to inverter 1 in order to bring the coolant pressure up for proper operation. The inverter restarted with no issues and production was confirmed with C4.. TechDispatched: Yes,Inverter,NC,2016-08-31,6979.0,5010.0,Utility-scale,Fixed,Central,Eaton Cooper Crouse-Hinds
C3S22,2018-04-04 11:00:00:00,2019-03-22 17:00:00,"Sullivan Inverter 3.5 Production Intermittent. ***UPDATE 10-Jul-2018:*** SMA performed upgrade/changes remotely on 9-Jul-2018. This will have to be confirmed to have worked when the weather is cooler again in the fall. Email attached to WO for more details. Inverters 2.4, 3.5, 3.6 had several intermittent outages on 4/4/18 lasting approximately 10 to 30 minutes each. No inverter fault reported into PowerTrack. On Hold notes: This is a problem every year. It's happening because of DC overvoltage. Our array is oversized. This problem will seem to disappear in the summer months. Over the next few weeks C4eng will look into this deeper and decide the best way to remove some voltage.. 018 - Planned outage/derate",Refer to WO-0190939. TechDispatched: No,Inverter,IN,2016-09-12,7054.0,5280.0,Utility-scale,Fixed,,SMA America
C3S22,2018-04-04 11:00:00:00,2019-03-22 17:00:00,"Sullivan Inverter 3.6 Production Intermittent. ***UPDATE 10-Jul-2018:*** SMA performed upgrade/changes remotely on 9-Jul-2018. This will have to be confirmed to have worked when the weather is cooler again in the fall. Email attached to WO for more details. Inverters 2.4, 3.5, 3.6 had several intermittent outages on 4/4/18 lasting approximately 10 to 30 minutes each. No inverter fault reported into PowerTrack. On Hold Notes: This is a problem every year. It's happening because of DC overvoltage. Our array is oversized. This problem will seem to disappear in the summer months. Over the next few weeks C4eng will look into this deeper and decide the best way to remove some voltage.. 019 - Unplanned outage/derate",Refer to WO-0190939. TechDispatched: Yes,Inverter,IN,2016-09-12,7054.0,5280.0,Utility-scale,Fixed,,SMA America
C3S27,2018-06-18 07:05:00:00,2018-06-19 04:55:00:00,"String Inverter offline Canceled OE deleted in batch process: OE-7380472. String inverter 1-1-2 has been reading 0Kw consistently when comms are available. C4 is currently unable to connect to the cluster controller. Onsite investigation recommended. 7/16/2018 Tim Chaput - Inverter has resumed communications, is found to be producing. - Closing WO.. 020 - Data/Communication System Outage","7/16/2018 Tim Chaput - Inverter has resumed communications, is found to be producing. - Closing WO.. TechDispatched: No",Inverter,MA,2016-01-13,2822.0,2340.0,Utility-scale,Fixed,string,SMA America
C3S290,2018-08-09 23:05:00:00,2018-09-17 09:20:00:00,"Jefferson Lewis - Inverter 1 - Communications Outage. Inverter 1 is not communicating in PowerFactors or Skytron. Verified production using site meter. Screenshot attached. 8/14/2018 Tim Chaput - Was on site today to evaluate communications of Inv 1. - All configurations (internal to inverter) appeared to be correct. - All wiring, Ethernet, and RS 485 were tested, and found no issues. - Contacted Solectria for evaluation. They have opened a case (#99539). They can see the datalogger in the unit, but have no production data since unit was installed. There is no official Solarenview site established with this site, but they still have the ability to see the inverters. - It was advised to have our DAS provider look into the issue before moving forward with this item. 8/24/2018 Tim Chaput - Confirmed with Skytron that they are not receiving any data. 8/28/2018 Tim Chaput - Contacted Solectria via email (8/24/2018), and phone call 8/28. Spoke to Burh in monitoring / engineering. - Currently Solectria Engineering is looking into the issue. It is believed at this time there is a firmware version that is incorrect or corrupted. They are still looking into the solution, and if it can be corrected remotely. - Solectria is still receiving time stamp data from the inverter. 9/11/2018 Tim Chaput - Solectria has finally figured out what the issue is. Engineers found the S/N programmed into the unit at the time of the DC monitoring install was programmed with one number off the actual S/N. - Solectria Tech to be onsite 9/12/18 (Solectria WO- 00055322) (Case # 99539) 9/12/2018 Tim Chaput - Solectria tech onsite - Tech programmed unit with correct S/N. Unit had S/N 140000-00, changed to S/N 151028-25. - Confirmed with Solectria that they have full communications with unit at this time. - Skytron still has no communications. (Skytron ticket # TSA-4872). Asking for them to check configuration. - All coms gear on site tested good. 11/20/2018 Tim Chaput - Replaced Solectria supplied RMA com card. - Configured - Inverter resumed normal communications!. 020 - Data/Communication System Outage","8/14/2018 Tim Chaput - Was on site today to evaluate communications of Inv 1. - All configurations (internal to inverter) appeared to be correct. - All wiring, Ethernet, and RS 485 were tested, and found no issues. - Contacted Solectria for evaluation. They have opened a case (#99539). They can see the datalogger in the unit, but have no production data since unit was installed. There is no official Solarenview site established with this site, but they still have the ability to see the inverters. - It was advised to have our DAS provider look into the issue before moving forward with this item. 8/24/2018 Tim Chaput - Confirmed with Skytron that they are not receiving any data. 8/28/2018 Tim Chaput - Contacted Solectria via email (8/24/2018), and phone call 8/28. Spoke to Burh in monitoring / engineering. - Currently Solectria Engineering is looking into the issue. It is believed at this time there is a firmware version that is incorrect or corrupted. They are still looking into the solution, and if it can be corrected remotely. - Solectria is still receiving time stamp data from the inverter. 9/11/2018 Tim Chaput - Solectria has finally figured out what the issue is. Engineers found the S/N programmed into the unit at the time of the DC monitoring install was programmed with one number off the actual S/N. - Solectria Tech to be onsite 9/12/18 (Solectria WO- 00055322) (Case # 99539) 9/11/2018 Tim Chaput - Solectria has finally figured out what the issue is. Engineers found the S/N programmed into the unit at the time of the DC monitoring install was programmed with one number off the actual S/N. - Solectria Tech to be onsite 9/12/18 (Solectria WO- 00055322) (Case # 99539) 9/12/2018 Tim Chaput - Solectria tech re-programmed S/N in unit. - Solectria now has full communications with unit. - Skytron ticket (TSA-4872) opened. 9/14/2018 - Skytron responded and is looking into the issue. 9/21/2018 Tim Chaput - Skytron is suspecting a Mod-bus issue with either the inverter or DAS. - Still in progress. - Solectria still has communications with this inverter. 10/30/2018 Tim Chaput - Skytron configurations have been double checked (no issues). - Solectria has finally agreed to send replacement communication module suspecting RS485 portion has failed, and there is no firmware issue. - Solectria still has communications with this inverter via Ethernet communications. - Solectria to ship RMA unit on, or around 11/16 due to back order.. TechDispatched: Yes",Inverter,NY,2017-12-29,2636.0,2000.0,Utility-scale,Fixed,,Solectria
C3S290,2018-08-07 13:25:00:00,2018-08-08 09:45:00:00,Jefferson - Inverter 3 - Forced Outage. Inverter 3 is offline not communicating in PowerFactors. Loss of production verified by the meter reading. Screenshots attached.. 018 - Planned outage/derate,"EPC working with Solectria to install DC monitoring capability 8/9/2018 Tim Chaput - Solectria install of DC components completed. - They forgot to plug the Ethernet cable back into unit when completed. - Unit is operational, and communicating at this time.. TechDispatched: No",Inverter,NY,2017-12-29,2636.0,2000.0,Utility-scale,Fixed,,Solectria
C3S114,2016-10-17 17:00:00:00,2016-12-31 12:00:00:00,WO-00001969 ; Angel Solar ; Prod-Inverter1-GF---Created By; Sean P. McCormick on: 10/17/2016?. Prod-Inverter1-GF---Created By; Sean P. McCormick on: 10/17/2016. ,150. TechDispatched: No,Inverter,NC,2015-10-07,6908.0,5010.0,Utility-scale,Fixed,central,Eaton Cooper Crouse-Hinds
C3S114,2016-10-17 17:00:00:00,2017-04-24 13:07:00:00,WO-00001991 ; Angel Solar ; Prod-CCR-Inv 3---Created By; Sean P. McCormick on: 10/17/2016?. Prod-CCR-Inv 3---Created By; Sean P. McCormick on: 10/17/2016. ,600. TechDispatched: No,Inverter,NC,2015-10-07,6908.0,5010.0,Utility-scale,Fixed,central,Eaton Cooper Crouse-Hinds
C3S114,2017-06-21 08:36:00:00,2017-06-21 16:06:00:00,WO-00004533 ; Angel Solar ; Inverter 3.3 Faulted---Created By; Julien Glover on: 06/21/2017? ; Fault Code: Ctw14 pump control warning. Inverter 3.3 Faulted---Created By; Julien Glover on: 06/21/2017. ,Investigated inverter three. Inverter was showing a ctw14. Pump control warning fault. Called Elton to troublesome. Determined there was a blown fuse at wire 256. Replace fuse and production resumed.. TechDispatched: No,Inverter,NC,2015-10-07,6908.0,5010.0,Utility-scale,Fixed,central,Eaton Cooper Crouse-Hinds
C3S114,2017-07-14 08:25:00:00,2017-08-16 12:57:00:00,WO-00005078 ; Angel Solar ; Central Inverter - Production Outage ; Fault Code: Out PSI at 14. Inverter not starting this morning. No alarms raised in AE.---Created By; Rush Ferrell on: 07/14/2017. 019 - Unplanned outage/derate,Coolant topped off.. TechDispatched: No,Inverter,NC,2015-10-07,6908.0,5010.0,Utility-scale,Fixed,central,Eaton Cooper Crouse-Hinds
C3S114,2017-07-13 08:45:00:00,2017-08-15 16:51:00:00,"WO-00005054 ; Angel Solar ; Central Inverter - Production Outage ; Fault Code: Out PSI at 14. Inverter faulted. ""Out PSI at 14"" message in AlsoEnergy---Created By; Sean P. McCormick on: 07/13/2017. 019 - Unplanned outage/derate","Checked the pump cabinet for any leaks or signs of damage, none were found. We replaced the pump in the inverter on 7/12 with Barago. Reset the inverter and it came back up and running, Going to meet with Jake tomorrow to add coolant to inverter.. TechDispatched: No",Inverter,NC,2015-10-07,6908.0,5010.0,Utility-scale,Fixed,central,Eaton Cooper Crouse-Hinds
C3S114,2017-12-29 09:14:00:00,2017-12-29 16:10:00:00,WO-00008134 ; Angel Solar ; Central Inverter - Production Outage ; Fault Code: THM15: Coolant Pressure. Inverter 3.3 offline. Out PSI fault.---Created By; Ben Knowles on: 12/29/2017. 019 - Unplanned outage/derate,"Inspect inverter for damage, coolant leaks. Disabled inverter and Cleared faults in hmi. Follow SOP procedure to add 50/50 glycol to coolant system to adjust pressure according to recommended pressure. Enabled inverter and verified production.. TechDispatched: No",Inverter,NC,2015-10-07,6908.0,5010.0,Utility-scale,Fixed,central,Eaton Cooper Crouse-Hinds
C3S114,2017-12-02 11:18:00:00,2017-12-12 15:30:00:00,WO-00007672 ; Angel Solar ; Central Inverter - Production Outage ; Fault Code: 509/Inverter Stopped. Inverter 1.1 did not come online this morning. Previous WO's suggest this may be an issue with the wake-up timer. No faults indicated in AlsoEnergy. Loss of production verified through meter.---Created By; Ben Knowles on: 12/02/2017. 019 - Unplanned outage/derate,"Found Inverter with SEQ2 fault: Wake up timeout. Attempted power cycle twice with same fault occurring each time. Performed additional troubleshooting per Eaton's request and found PT on B phase was bad. Replaced Faulty PT on B phase, verified fuses were good, and replaced OPDB board.. TechDispatched: No",Inverter,NC,2015-10-07,6908.0,5010.0,Utility-scale,Fixed,central,Eaton Cooper Crouse-Hinds
C3S114,2017-12-10 18:14:00:00,2017-12-11 15:33:00:00,WO-00007796 ; Angel Solar ; Central Inverter - Production Outage ; Fault Code: THM15: Coolant Pressure. Inverter 3.3 offline. Out PSI fault---Created By; Sean M. McCormick on: 12/10/2017. 019 - Unplanned outage/derate,Inspected Inverter. Found Inverter with a THM15: Coolant Pressure fault. Inspected Inverter Coolant pump system for leaks. Forced Coolant pump on using HMI for 5 minutes. Power cycled inverter. Verified Inverter was producing.. TechDispatched: No,Inverter,NC,2015-10-07,6908.0,5010.0,Utility-scale,Fixed,central,Eaton Cooper Crouse-Hinds
C3S114,2017-11-26 08:53:00:00,2017-11-26 13:15:00:00,WO-00007580 ; Angel Solar ; Central Inverter - Production Outage ;. Inverter 1.1 offline. Did not come online this morning. Previous WOs allude that it is an issue with the wake-up timer.---Created By; Sean M. McCormick on: 11/26/2017. 019 - Unplanned outage/derate,"Arrived at site to troubleshoot wakeup timer fault that has been intermittent. Checked voltages on the AC and DC side. Everything was correct and nothing was off, put the Inverter in sync inhibit and watched the screen and everything lit up with no issues. Power cycled the Inverter and the inverter came back online and started producing.. TechDispatched: No",Inverter,NC,2015-10-07,6908.0,5010.0,Utility-scale,Fixed,central,Eaton Cooper Crouse-Hinds
C3S114,2017-10-20 10:59:00:00,2017-10-21 08:45:00:00,WO-00007127 ; Angel Solar ; Central Inverter - Production Outage ;. Inverter 1.1 offline. No specific faults indicated in PowerTrack.---Created By; Julien Glover on: 10/20/2017. 019 - Unplanned outage/derate,"Reviewed Fault logs and Service GUI for proper status indicators. Verified AC/DC voltages, verified connections to Panda board. Power cycled unit.. TechDispatched: No",Inverter,NC,2015-10-07,6908.0,5010.0,Utility-scale,Fixed,central,Eaton Cooper Crouse-Hinds
C3S114,2017-10-08 12:08:00:00,2017-10-09 08:00:00:00,WO-00006888 ; Angel Solar ; Central Inverter - Production Outage ;. Inverter 1.1 offline. No specific faults indicated in PowerTrack.---Created By; Julien Glover on: 10/08/2017. 019 - Unplanned outage/derate,Self Resolved.. TechDispatched: No,Inverter,NC,2015-10-07,6908.0,5010.0,Utility-scale,Fixed,central,Eaton Cooper Crouse-Hinds
C3S114,2017-10-06 08:53:00:00,2017-10-06 14:00:00:00,WO-00006857 ; Angel Solar ; Central Inverter - Production Outage ; Fault Code: SEQ2. Inverter 1.1 offline. No specific faults indicated---Created By; Julien Glover on: 10/06/2017. 019 - Unplanned outage/derate,"Inverter was down due to a wake up timer fault, Called Sam @ Eaton and troubleshot issue. Checked connections to a board and found no issues. Plugged back up and Inverter came back on at full production.. TechDispatched: No",Inverter,NC,2015-10-07,6908.0,5010.0,Utility-scale,Fixed,central,Eaton Cooper Crouse-Hinds
C3S114,2017-09-29 09:53:00:00,2017-09-29 14:00:00:00,"WO-00006750 ; Angel Solar ; Central Inverter - Production Outage ;. Inverter 1.1 offline. Fault in Powertrack detected at 08:11AM, have seen no production from it.---Created By; Ben Knowles on: 09/29/2017. 019 - Unplanned outage/derate","Arrived onsite to find that the Inverter was faulted out with a wake up timer fault. Disabled the inverter and did a shutdown request. When the Inverter was de-energized, we opened up all the DC disconnect switches. With the DC off we opened the DC breaker cabinet on the Inverter. We measured the voltage between F1 and F2 fuses, it showed the voltage at 8 VDC. The HIM screen showed 12 VDC, after taking the measurements we opened the fuses holder and measured the voltage to ground. We got 7.6 vdc pos to gnd and 0 vdc neg to gnd, the screen was reading 0 to ground now. Called Sam with Eaton and explained what was going on, he had us put the inverter in sync inhibit and that run the inverter. This showed that the VTB was working correctly. Power cycled the 120 VAC power and turned the inverter back on with no issues. Need to keep a check with Inverter, if problem comes back could need a new VTB and programming.. TechDispatched: No",Inverter,NC,2015-10-07,6908.0,5010.0,Utility-scale,Fixed,central,Eaton Cooper Crouse-Hinds
C3S114,2017-09-26 12:48:00:00,2017-09-27 12:30:00:00,"WO-00006696 ; Angel Solar ; Central Inverter - Production Outage ;. Inverter 1.1 offline. Fault detected in Powertrack, but no specifics.---Created By; Julien Glover on: 09/26/2017. 019 - Unplanned outage/derate","Discovered unit faulted with DCF5 DC Over fast fault. Visually inspected inverter, power cycled and unit returned to normal operation.. TechDispatched: No",Inverter,NC,2015-10-07,6908.0,5010.0,Utility-scale,Fixed,central,Eaton Cooper Crouse-Hinds
C3S114,2017-07-18 11:55:00:00,2017-08-29 16:30:00:00,WO-00005175 ; Angel Solar ; Central Inverter - Damaged Equipment ;. Inverter 2 Fan 3 replacement.---Created By; Frankie Alford on: 07/18/2017. 013 - Broken,"Disabled the Inverter and shutdown inverter via HMI screen, turned off all DC disconnects. After all DC power was off, shut off transformer and measured voltage in Inverter, all voltage was 0. Changed out #3 fan and rewired, re-energized all equipment with AC power. Checked voltage on the #3 fan and was getting 121 VAC. Re-energized all DC equipment and re-enabled the Inverter, Inverter came back up with no issues and was exporting.. TechDispatched: No",Inverter,NC,2015-10-07,6908.0,5010.0,Utility-scale,Fixed,central,Eaton Cooper Crouse-Hinds
C3S114,2017-07-18 11:56:00:00,2017-08-29 16:30:00:00,WO-00005176 ; Angel Solar ; Central Inverter - Damaged Equipment ;. Inverter 3 Fan 3 replacement.---Created By; Frankie Alford on: 07/18/2017. 013 - Broken,"Disabled the Inverter and shutdown inverter via HMI screen, turned off all DC disconnects. After all DC power was off, shut off transformer and measured voltage in Inverter, all voltage was 0. Changed out #3 fan and rewired, re-energized all equipment with AC power. Checked voltage on the #3 fan and was getting 121 VAC. Re-energized all DC equipment and re-enabled the Inverter, Inverter came back up with no issues and was exporting.. TechDispatched: No",Inverter,NC,2015-10-07,6908.0,5010.0,Utility-scale,Fixed,central,Eaton Cooper Crouse-Hinds
C3S114,2017-07-18 11:48:00:00,2017-08-29 16:30:00:00,WO-00005174 ; Angel Solar ; Central Inverter - Damaged Equipment ;. Inverter 1 Fan 3 replacement.---Created By; Frankie Alford on: 07/18/2017. 013 - Broken,"Disabled the Inverter and shutdown inverter via HMI screen, turned off all DC disconnects. After all DC power was off, shut off transformer and measured voltage in Inverter, all voltage was 0. Changed out #3 fan and rewired, re-energized all equipment with AC power. Checked voltage on the #3 fan and was getting 121 VAC. Re-energized all DC equipment and re-enabled the Inverter, Inverter came back up with no issues and was exporting.. TechDispatched: No",Inverter,NC,2015-10-07,6908.0,5010.0,Utility-scale,Fixed,central,Eaton Cooper Crouse-Hinds
C3S114,2017-06-30 09:49:00:00,2017-06-30 15:45:00:00,WO-00004775 ; Angel Solar ; Inverter 3.3 is faulted and not producing---Created By; Rush Ferrell on: 06/30/2017?. Inverter 3.3 is faulted and not producing---Created By; Rush Ferrell on: 06/30/2017. 019 - Unplanned outage/derate,"I rolled out to Angel today to investigate a fault on inverter 3. The inverter fault page displayed a control pump fault. While engaging the door bypass, so that I could check the pump control fuses in the AC cabinet, I noticed that the Force Pump button was engaged. I also found that two of the three pump control fuses, F49 and F50, had cleared. F51 had not cleared. I then went to look at the pump and discovered that it had been leaking what looked like glycol. It did not look like the substance had been leaking from either intake or outtake hose, but from the bottom of the pump itself. The substance had dried and coagulated around the bottom of the pump. After sending pictures of my findings to Sam Delacruz and discussing what the next move should be, we decided to replace all three LP-CC-10 10 amp 600vac pump control fuses. Prior to replacing the fuses, I attempted to clean some of the dried substance, but proved to be too difficult without some sort of scotch brite pad. I enabled the inverter after carefully replacing the fuses, disengaging the pump, and clearing the fault. The inverter came back up and began exporting power. Upon leaving the site, C4 said that the inverter in question was not producing. When I went back to look at the inverter, it was not producing and the fault page was displaying IGBT health temp. fault. When I looked at the pump control fuse indicators, F51 was on. However, after checking the fuses for continuity, all were fine and none had cleared. I checked the line-to-line incoming AC voltage on the pump contactor and was not reading any voltage. Further investigation will be required by turning off the transformer, which I am not authorized to do. Jonathan Greene and myself will be coming back out next week to further troubleshoot. I will be posting pictures of the pump to BOX. Kevin from Berrago Solar onsite and replaced seal pump 07/11/2017. TechDispatched: No",Inverter,NC,2015-10-07,6908.0,5010.0,Utility-scale,Fixed,central,Eaton Cooper Crouse-Hinds
C3S114,2018-08-22 09:11:00:00,2018-08-22 15:11:00:00,Inverters intermittent. Inverters intermittent due to unknown reasons.. 0000 - Unknown,. TechDispatched: No,Inverter,NC,2015-10-07,6908.0,5010.0,Utility-scale,Fixed,central,Eaton Cooper Crouse-Hinds
C3S114,2019-08-09 11:45:00,2019-08-10 10:55:00,Angel - Inverter 3 - Forced outage. Angel Inverter 3 dropped offline @ 1140 AM on 8/9/19. C4 does not have remote access to EATON inverters at any time. Site visit required. Production loss confirmed via meter in PowerTrack Eaton fault code in Power Tracks alarms shows as 440. 019 - Unplanned outage/derate,"8/10 - Arrived on site and found Inverter 3 offline and not producing power. Opened HMI and found inverter with the following critical Fault(s): - 41 08/09 PSF1: INV1 24V Fail I referred to the fault code above in the Eaton Power Xpert PDF manual. PSF1 fault means that a particular power supply had a fault/failure. It gives the following as troubleshooting steps: Inverter Stack-1 SIB 24 V Power Supply Failure 1. Check for 24 V on the SIB (Inverter 1) from 280 Vdc/24 Vdc power supply, PS5 24 Vdc across SIB1-J8-1 (wire 18RD313) and SIB1-J8-2 (wire 18BK314) 2. Check for 280 Vdc across TB2-2 (wire 18RD606) and TB2-9 (wire 18BK612) 3. Check for 280 Vdc across TB2-1 (wire 14RD603) and TB2-9 (wire 14BK604) 4. Replace power supply if defective 5. Contact Eaton for a SIB1 failure Each step was tested and confirmed w/ proper voltages. Once I cleared the fault the inverter resumed production as normal.",Inverter,NC,2015-10-07,6908.0,5010.0,Utility-scale,Fixed,central,Eaton Cooper Crouse-Hinds
C3S80,2019-07-20 07:30:00,2019-07-20 16:55:00,"Maxton - Inverter 4 - Forced Outage. 07:30 EST 07/20/19 Maxton Inverter 4 tripped offline due to a 3502-GFDI. C4 is attempting to perform a reset on the Inverter. Reset was unsuccessful, Site Visit is required.. 001 - Ground fault","7/20/19 Upon arrival at site, Inverter 4 was not running with the GFDI tripped. Power cycled inverter and inverter started with no issues. Confirmed with C4 that inverter is online and producing.",Inverter,NC,2016-09-20,7008.0,5280.0,Utility-scale,Fixed,central,SMA America
C3S220,2019-08-24 09:15:00,2019-08-24 14:00:00,"South Louisburg - Inverter 1 - Forced Outtage/comms. 08/24/19 09:15 EST South Louisburg Inverter 1 stopped producing/communicating. C4 can not remotely log into this Inverter, also C4 cannot connect to the Shark Meter for Inverter 1. Site Visit is required to verify if it's a comms issue or if the Inverter is offline.. 019 - Unplanned outage/derate","8/24/: A.Clack, Inverter 1 was offline upon arrival with a coolant pressure fault. Coolant pressure at the HMI was -6 psi, and the analog gauge at 0 psi. Three initial pumps raised the psi from -6 to 24. This unit required very little coolant to be brought back within normal operating range. Coolant pressure was left at 26 psi with the unit back online.",Inverter,NC,2016-08-31,6979.0,5010.0,Utility-scale,Fixed,Central,Eaton Cooper Crouse-Hinds
C3S220,2019-06-23 07:30:00,2019-06-24 14:30:00,South Louisburg - Inverter 1 - Forced outage. Inverter 1 is offline as of 730 on 06/23/19. C4 verified loss of production through the Shark meter. The 1024 fault code being indicated in PowerFactors does not correlate with any fault codes in the Eaton Power Expert manual.. 019 - Unplanned outage/derate,"Upon arrival the inverter was offline due to low pressure. During troubleshooting a small leak was discovered around the PT1 fitting. The fitting was able to be tightened a 1/4 turn. After tightening and cleaning, the coolant system was re-balanced and the inverter resumed normal operation. After the inverter ran for a while the fitting showed no signs of leaking.",Inverter,NC,2016-08-31,6979.0,5010.0,Utility-scale,Fixed,Central,Eaton Cooper Crouse-Hinds
C3S220,2019-06-07 09:00:00,2019-07-30 17:00:00,South Louisburg - Inverter 1 - AC Breaker Door. The AC breaker door of inverter 1 was found off with both hinges broken.. 013 - Broken,"The factory rivets were drilled out of the door and hinges. Screws and epoxy were purchase for the repair. After the screws were installed, the epoxy was applied to the backside to hold the screws tight.",Inverter,NC,2016-08-31,6979.0,5010.0,Utility-scale,Fixed,Central,Eaton Cooper Crouse-Hinds
